{
  "schema_version": "ultimate-odycer.creative-tools-catalog.v1",
  "verified_on": "2026-08-26",
  "pricing_policy": "model_only_no_exact_prices",
  "default_strategy": "local_first_free_open_source",
  "tools": [
    {"id":"creature-editor-lite","name":"Creature Editor Lite","provider":"Ultimate Odycer","ownership":"ultimate_odycer","domains":["characters","creatures"],"maturity":"executable_public","execution":"local","pricing_model":["contact_sales"],"commercial_use":"verification_required","commercial_use_note":"Public source slice exists, but repository terms and exported content rights must be reviewed.","privacy":"Local and offline; no remote runtime dependency.","ai_training_terms":"not_applicable","integration":"conversion_required","inputs":["xenogenome-lite-json"],"outputs":["validated-xenogenome-lite-json"],"platforms":["windows","linux"],"official_url":"https://github.com/zedarvates/ultimate-odycer-tools-suite/tree/main/tools/creature-editor-lite","pricing_or_license_url":"https://github.com/zedarvates/ultimate-odycer-tools-suite/blob/main/LICENSE.md","verified_on":"2026-08-26","notes":"Executable zero-dependency slice; preview remains Scaffolding / Proxy and server may reject proposals."},
    {"id":"city-editor-lite","name":"City Editor Lite","provider":"Ultimate Odycer","ownership":"ultimate_odycer","domains":["maps","city"],"maturity":"executable_public","execution":"local","pricing_model":["contact_sales"],"commercial_use":"verification_required","commercial_use_note":"Public source slice exists; repository and exported content terms require review.","privacy":"Local and offline.","ai_training_terms":"not_applicable","integration":"conversion_required","inputs":["city-config-lite-json"],"outputs":["validated-city-config-lite-json"],"platforms":["windows","linux"],"official_url":"https://github.com/zedarvates/ultimate-odycer-tools-suite/tree/main/tools/city-editor-lite","pricing_or_license_url":"https://github.com/zedarvates/ultimate-odycer-tools-suite/blob/main/LICENSE.md","verified_on":"2026-08-26","notes":"Executable survey slice; grid preview does not execute Zig, Godot, navigation, collision or publication."},
    {"id":"architecture-editor-lite","name":"Architecture Editor Lite","provider":"Ultimate Odycer","ownership":"ultimate_odycer","domains":["architecture"],"maturity":"executable_public","execution":"local","pricing_model":["contact_sales"],"commercial_use":"verification_required","commercial_use_note":"Public source slice exists; repository and output terms require review.","privacy":"Local and offline.","ai_training_terms":"not_applicable","integration":"conversion_required","inputs":["house-blueprint-lite-json"],"outputs":["validated-house-blueprint-lite-json"],"platforms":["windows","linux"],"official_url":"https://github.com/zedarvates/ultimate-odycer-tools-suite/tree/main/tools/architecture-editor-lite","pricing_or_license_url":"https://github.com/zedarvates/ultimate-odycer-tools-suite/blob/main/LICENSE.md","verified_on":"2026-08-26","notes":"Executable drafting slice with no costs, HP, assets, collision, HLOD, Godot, VR or publication."},
    {"id":"dungeon-editor-lite","name":"Dungeon Editor Lite","provider":"Ultimate Odycer","ownership":"ultimate_odycer","domains":["dungeon","maps"],"maturity":"executable_public","execution":"local","pricing_model":["contact_sales"],"commercial_use":"verification_required","commercial_use_note":"Lite source slice exists; repository and exported content rights require review.","privacy":"Local and offline.","ai_training_terms":"not_applicable","integration":"conversion_required","inputs":["dungeon-blueprint-lite-json"],"outputs":["validated-dungeon-blueprint-lite-json"],"platforms":["windows","linux"],"official_url":"https://github.com/zedarvates/ultimate-odycer-tools-suite/tree/main/tools/dungeon-editor-lite","pricing_or_license_url":"https://github.com/zedarvates/ultimate-odycer-tools-suite/blob/main/LICENSE.md","verified_on":"2026-08-27","notes":"Executable survey slice; excludes rewards, loot, species, meshes, props, Zig loader and publication. Preview remains proxy."},
    {"id":"avatar-editor-lite","name":"Avatar Editor Lite","provider":"Ultimate Odycer","ownership":"ultimate_odycer","domains":["characters"],"maturity":"executable_public","execution":"local","pricing_model":["contact_sales"],"commercial_use":"verification_required","commercial_use_note":"Lite source slice exists; repository and exported content rights require review.","privacy":"Local and offline.","ai_training_terms":"not_applicable","integration":"conversion_required","inputs":["avatar-template-lite-json"],"outputs":["validated-avatar-template-lite-json"],"platforms":["windows","linux"],"official_url":"https://github.com/zedarvates/ultimate-odycer-tools-suite/tree/main/tools/avatar-editor-lite","pricing_or_license_url":"https://github.com/zedarvates/ultimate-odycer-tools-suite/blob/main/LICENSE.md","verified_on":"2026-08-27","notes":"Executable contract slice; preview and outputs do not prove GLB, Godot, VR, server or production integration."},
    {"id":"threejs-2-5d-template","name":"Three.js 2.5D MMORPG Template","provider":"Ultimate Odycer","ownership":"ultimate_odycer","domains":["template","2d","3d","ui"],"maturity":"executable_public","execution":"local","pricing_model":["free_open_source"],"commercial_use":"allowed","commercial_use_note":"Original code and documentation are MIT; third-party or future assets retain separate rights.","privacy":"Offline development shell; network endpoint is intentionally absent.","ai_training_terms":"not_applicable","integration":"reference_only","inputs":["game-content-graph-json","procedural-assets"],"outputs":["web-client-build","validated-content-manifest"],"platforms":["web"],"official_url":"https://github.com/zedarvates/ultod-client-threejs-2-5d-mmorpg-template","pricing_or_license_url":"https://github.com/zedarvates/ultod-client-threejs-2-5d-mmorpg-template/blob/main/LICENSE","verified_on":"2026-08-27","notes":"Executable Vite shell and Content SDK with fail-closed network stub. Hybrid 3D-to-sprite and SFX pipelines are planned, not shipped."},
    {"id":"architecture-editor","name":"Architecture Editor","provider":"Ultimate Odycer","ownership":"ultimate_odycer","domains":["architecture","dungeon"],"maturity":"prototype_local","execution":"local","pricing_model":["contact_sales"],"commercial_use":"verification_required","commercial_use_note":"Internal tool and asset licences are not granted by public screenshots.","privacy":"Local internal tool.","ai_training_terms":"not_applicable","integration":"conversion_required","inputs":["parts-json","styles-json","glb"],"outputs":["house-blueprint-json","preview-png"],"platforms":["windows"],"official_url":"https://github.com/zedarvates/ultimate-odycer-tools-suite/tree/main/tools/architecture-editor","pricing_or_license_url":"https://github.com/zedarvates/ultimate-odycer-tools-suite/blob/main/LICENSE.md","verified_on":"2026-08-26","notes":"Produces candidate blueprints; individual previews and contracts do not prove complete runtime adoption."},
    {"id":"dungeon-editor","name":"Dungeon Editor","provider":"Ultimate Odycer","ownership":"ultimate_odycer","domains":["dungeon","maps"],"maturity":"scaffolding_proxy","execution":"local","pricing_model":["contact_sales"],"commercial_use":"verification_required","commercial_use_note":"Public presentation does not distribute full source or runtime rights.","privacy":"Local presentation or internal prototype.","ai_training_terms":"not_applicable","integration":"conversion_required","inputs":["layout-intent","parts-catalog"],"outputs":["dungeon-blueprint-json"],"platforms":["windows"],"official_url":"https://github.com/zedarvates/ultimate-odycer-tools-suite/tree/main/tools/dungeon-editor","pricing_or_license_url":"https://github.com/zedarvates/ultimate-odycer-tools-suite/blob/main/LICENSE.md","verified_on":"2026-08-26","notes":"Hand-authored layout direction; no automatic server publication."},
    {"id":"creature-editor","name":"Creature Editor","provider":"Ultimate Odycer","ownership":"ultimate_odycer","domains":["characters","creatures"],"maturity":"scaffolding_proxy","execution":"local","pricing_model":["contact_sales"],"commercial_use":"verification_required","commercial_use_note":"Full editor remains extraction-gated.","privacy":"Local internal tool.","ai_training_terms":"not_applicable","integration":"conversion_required","inputs":["parts-catalog","reference-images"],"outputs":["xenogenome-json","review-artifacts"],"platforms":["windows"],"official_url":"https://github.com/zedarvates/ultimate-odycer-tools-suite/tree/main/tools/creature-editor","pricing_or_license_url":"https://github.com/zedarvates/ultimate-odycer-tools-suite/blob/main/LICENSE.md","verified_on":"2026-08-26","notes":"Produces candidates; stats, attacks, spawn and physics remain server-authoritative."},
    {"id":"avatar-editor","name":"Avatar Editor","provider":"Ultimate Odycer","ownership":"ultimate_odycer","domains":["characters"],"maturity":"scaffolding_proxy","execution":"local","pricing_model":["contact_sales"],"commercial_use":"verification_required","commercial_use_note":"Full editor and bundled assets remain extraction-gated.","privacy":"Local internal tool.","ai_training_terms":"not_applicable","integration":"conversion_required","inputs":["glb","morph-intent"],"outputs":["avatar-template-json","review-glb"],"platforms":["windows"],"official_url":"https://github.com/zedarvates/ultimate-odycer-tools-suite/tree/main/tools/avatar-editor","pricing_or_license_url":"https://github.com/zedarvates/ultimate-odycer-tools-suite/blob/main/LICENSE.md","verified_on":"2026-08-26","notes":"Preview does not prove server, GPU, VR or production integration."},